,Book Title,Author,Rating,Pages,Description,Links
17,Once a Runner,John L. Parker Jr.,4.07,226,"Once a Runner captures the essence of what it means to be a competitive runner; to devote your entire existence to a single-minded pursuit of excellence. It has become one of the most beloved sports novels ever written. Originally self-published in 1978 and sold at road races out of the trunk of the author’s car, reading the book became a rite of passage for many runners, and tattered copies were handed down like sacred texts from generation to generation.Once a Runner is the story of Quenton Cassidy, a collegiate runner at fictional Southeastern University whose lifelong dream is to run a four-minute mile. He is less than a second away when the political and cultural turmoil of the Vietnam War era intrudes into the staid recesses of his school’s athletic department. After he becomes involved in an athletes’ protest, Cassidy is suspended from his track team.Under the tutelage of his friend and mentor, Bruce Denton, a graduate student and former Olympic gold medalist, Cassidy gives up his scholarship, his girlfriend, and possibly his future to withdraw to a monastic retreat in the countryside and begin training for the race of his life: a head-to-head match with the greatest miler in history.This audiobook is a rare insider’s account of the incredibly intense lives of elite distance runners; an inspiring, funny, and spot-on tale of one man’s quest to become a champion.",https://www.goodreads.com/book/show/98250.Once_a_Runner
18,"My Year of Running Dangerously: A Dad, a Daughter, and a Ridiculous Plan",Tom Foreman,4.07,288,"CNN correspondent Tom Foreman's remarkable journey from half-hearted couch potato to ultra-marathon runner, with four half-marathons, three marathons, and 2,000 miles of training in between; a poignant and warm-hearted tale of parenting, overcoming the challenges of age, and quiet triumph.As a journalist whose career spans three decades, CNN correspondent Tom Foreman has reported from the heart of war zones, riots, and natural disasters. He has interviewed serial killers and been in the line of fire. But the most terrifying moment of his life didn't occur on the job--it occurred at home, when his 18-year old daughter asked, ""How would you feel about running a marathon with me?"" At the time, Foreman was approaching 51 years old, and his last marathon was almost 30 years behind him. The race was just sixteen weeks away, but Foreman reluctantly agreed. Training with his daughter, who had just started college, would be a great bonding experience, albeit a long and painful one. My Year of Running Dangerously is Foreman's journey through four half-marathons, three marathons, and one 55-mile race. What started as an innocent request from his daughter quickly turned into a rekindled passion for long-distance running--for the training, the camaraderie, the defeats, and the victories. Told with honesty and humor, Foreman's account captures the universal fears of aging and failure alongside the hard-won moments of triumph, tenacity, and going further than you ever thought possible.",https://www.goodreads.com/book/show/24612100-my-year-of-running-dangerously
19,"Duel in the Sun: Alberto Salazar, Dick Beardsley, and America's Greatest Marathon",John   Brant,4.05,210,"John Brant re-creates the tense drama of the 1982 Boston Marathon—and the powerful forces of fate that drove these two athletes in the years afterwards""One was a humble farm boy from Minnesota. The other was the most electrifying distance runner of his time. In 1982, they battled stride for stride for more than two hours in the most thrilling Boston Maraton ever run. Then the drama really began. . . ."" Thus John Brant sets the stage for the epic race that took place 23 years ago between Alberto Salazar and Dick Beardsley. Since Beardsley was only 26 and Salazar 23 at the time, everyone assumed that this would be the start of a long and glorious rivalry.Instead Beardsley soon began a descent into drug addiction that brought him perilously close to dying. Salazar's decline was more gradual, his vigor slowly giving way to baffling symptoms that left him completely exhausted. Brant's portraits of the painkiller-addicted Beardsley and the depression-plagued Salazar are at once sensitive and hair-raising. The supporting characters are also richly drawn, from Alberto's father, Jose Salazar, a towering presence with a fascinating history and a former close friend of Fidel Castro, to Bill Squires, Beardsley's coach, a Casey Stengel–like figure whose oddball goofiness masks an encyclopedic knowledge of distance running. This elegantly written story is riveting nonfiction at its very best.",https://www.goodreads.com/book/show/515066.Duel_in_the_Sun
20,"Pre: The Story of America's Greatest Running Legend, Steve Prefontaine",Tom Jordan,4.02,176,"For five years, no American runner could beat him at any distance over a mile. But at the age of 24, with his best years still ahead, long-distance runner Steve Prefontaine finally lost. Driving alone at night after a party, Prefontaine crashed his sports car, putting a tragic, shocking end to the life and career of one of the most influential, accomplished runners of our time. From his humble origins in Coos Bay, Oregon, Pre became the first person to win four NCAA titles in one event. Year after year, he was virtually unbeatable. Instead of becoming one of the new breed of professional track athletes, Pre chose to stay amateur and fight for the adequate funding he felt American amateur athletes deserved. But Pre not only touched runners; his exciting racing technique as well as his maverick lifestyle made him a favorite of the fans. A race with Prefontaine in it was automatically an event. This is his story.",https://www.goodreads.com/book/show/112146.Pre
21,Again to Carthage,John L. Parker Jr.,3.99,344,"John L. Parker, Jr.’s first novel, Once a Runner, is the cult novel for runners. Self-published in the late 1970s, and for years sold out of the trunk of the author’s car at running events, it went on to sell over 100,000 copies and achieve legendary status among runners.It perfectly captured the intensity, relentlessness, and sheer lunacy of a serious miler’s life. Kenny Moore of Sports Illustrated—himself an Olympic runner—called it “by far the best fictional portrayal of the world of a serious runner . . . a marvelous description of the way it really is.”For over twenty-five years, fans of Once a Runner have wanted more. Parker has finally written the sequel, which begins in the early 1970s where the previous book left off. The protagonist of the first book, Quenton Cassidy, has lost his best friend and teammate from college, a helicopter gunship pilot who dies a horrific death after crashing in the jungle. Cassidy is plunged into a depressive spiral in which he is forced to re-examine his studiously carefree life as a young, single attorney.Cassidy’s return to the world of competitive running is dramatic and revelatory both to Cassidy himself and to the reader, as is his desperate, all-out attempt to make one last Olympic team.John L. Parker, Jr. is the author of the highly acclaimed novel Once a Runner. He has written for Outside, Runner’s World, Running Times, and numerous other publications. He lives in Tallahassee, Florida, and Bar Harbor, Maine.",https://www.goodreads.com/book/show/2124589.Again_to_Carthage
22,Eat and Run: My Unlikely Journey to Ultramarathon Greatness,Scott Jurek,3.99,272,"For nearly two decades, Scott Jurek has been a dominant force—and darling—in the grueling and growing sport of ultrarunning. Until recently he held the American 24-hour record and he was one of the elite runners profiled in the runaway bestseller Born to Run.In Eat and Run, Jurek opens up about his life and career as a champion athlete with a plant-based diet and inspires runners at every level. From his Midwestern childhood hunting, fishing, and cooking for his meat-and-potatoes family to his slow transition to ultrarunning and veganism, Scott’s story shows the power of an iron will and blows apart the stereotypes of what athletes should eat to fuel optimal performance. Full of stories of competition as well as science and practical advice—including his own recipes—Eat and Run will motivate readers and expand their food horizons.",https://www.goodreads.com/book/show/13202092-eat-and-run
23,Marathon: The Ultimate Training Guide,Hal Higdon,3.98,356,"With over 50% new material, this category killer is sure to go the distanceWhen the previous edition of Hal Higdon's superb training guide appeared, Grete Waitz, 9-time winner of the New York City Marathon, cheered: ""Higdon's years of marathoning experience come through in this practical book. Aspiring or veteran marathoners will benefit enormously from its proven guidance.""This new edition focuses on first marathoners, women runners, and those new to the sport; and as always, Higdon shows how to build up mileage and gives advice on running long, speedwork for distance runners, defensive running strategies, and planning for peak performance.",https://www.goodreads.com/book/show/120244.Marathon
24,Ultramarathon Man: Confessions of an All-Night Runner,Dean Karnazes,3.98,295,"In one of his most ambitious physical efforts to date, Dean Karnazes attempted to run 50 marathons, in 50 states, in 50 days to raise awareness of youth obesity and urge Americans of all fitness levels to ""take that next step.""""UltraMarathon Man: 50 Marathons - 50 States - 50 Days"", a Journeyfilm documentary, follows Dean's incredible step-by-step journey across the country.Ultrarunning legend Dean Karnazes has run 262 miles-the equivalent of ten marathons-without rest. He has run over mountains, across Death Valley, and to the South Pole-and is probably the first person to eat an entire pizza while running. With an insight, candor, and humor rarely seen in sports memoirs (and written without the aid of a ghostwriter or cowriter), Ultramarathon Man has inspired tens of thousands of people-nonrunners and runners alike-to push themselves beyond their comfort zones and be reminded of ""what it feels like to be truly alive,"" says Sam Fussell, author of Muscle.Ultramarathon Man answers the questions Karnazes is continually asked:- Why do you do it?- How do you do it?- Are you insane?And in the new paperback edition, Karnazes answers the two questions he was most asked on his book tour:- What, exactly, do you eat?- How do you train to stay in such good shape?",https://www.goodreads.com/book/show/87632.Ultramarathon_Man
25,"Finding Ultra: Rejecting Middle Age, Becoming One of the World's Fittest Men, and Discovering Myself",Rich Roll,3.97,400,"An alternate cover for this edition can be found here.Finding Ultra is an incredible but true account of achieving one of the most awe-inspiring midlife physical transformations everOn the night before he was to turn forty, Rich Roll experienced a chilling glimpse of his future. Nearly fifty pounds overweight and unable to climb the stairs without stopping, he could see where his current sedentary life was taking him—and he woke up. Plunging into a new routine that prioritized a plant-based lifestyle and daily training, Rich morphed—in a matter of mere months—from out of shape, mid-life couch potato to endurance machine. Finding Ultra recounts Rich’s remarkable journey to the starting line of the elite Ultraman competition, which pits the world’s fittest humans in a 320-mile ordeal of swimming, biking, and running. And following that test, Rich conquered an even greater one: the EPIC5—five Ironman-distance triathlons, each on a different Hawaiian island, all completed in less than a week. In the years since Finding Ultra was published, Rich has become one of the world’s most recognized advocates of plant-based living. In this newly revised and updated edition, he shares the practices, tools, and techniques he uses for optimal performance, longevity, and wellness, including diet and nutrition protocols. Rich reflects on the steps he took to shift his mindset and leverage deep reservoirs of untapped potential to achieve success beyond his wildest imagination, urging each of us to embark on our own journey of self-discovery.",https://www.goodreads.com/book/show/39665673-finding-ultra
26,"Runner's World Run Less, Run Faster: Become a Faster, Stronger Runner with the Revolutionary FIRST Training Program",Bill Pierce,3.95,272,"Finally, runners at all levels can improve their race times while training less, with the revolutionary Furman Institute of Running and Scientific Training (FIRST) program.Hailed by the Wall Street Journal and featured twice in six months in cover stories in Runner's World magazine, FIRST's unique training philosophy makes running easier and more accessible, limits overtraining and burnout, and substantially cuts the risk of injury, while producing faster race times.The key feature is the ""3 plus 2"" program, which each week consists of:-3 quality runs, including track repeats, the tempo run, and the long run, which are designed to work together to improve endurance, lactate-threshold running pace, and leg speed-2 aerobic cross-training workouts, such as swimming, rowing, or pedaling a stationary bike, which are designed to improve endurance while helping to avoid burnoutWith detailed training plans for 5K, 10K, half marathon, and marathon, plus tips for goal-setting, rest, recovery, injury rehab and prevention, strength training, and nutrition, this program will change the way runners think about and train for competitive races.Amby Burfoot, Runner's World executive editor and Boston Marathon winner, calls the FIRST training program ""the most detailed, well-organized, and scientific training program for runners that I have ever seen.""",https://www.goodreads.com/book/show/705694.Runner_s_World_Run_Less_Run_Faster
27,"My Life on the Run: The Wit, Wisdom, and Insights of a Road Racing Icon",Bart Yasso,3.95,270,"
 Dubbed the ""Mayor of Running,"" Bart Yasso is one of the best-known figures in the sport, but few people know why he started running competitively, how it changed his life, or how his brush with a crippling illness nearly ended his career a decade ago. With insight and humor, My Life on the Run chronicles the heatstroke and frostbite, heartache and triumphs heâ€™s experienced while competing in more than 1,000 competitive races during his nearly 30 years with Runnerâ€™s World magazine. 
 Yasso gives valuable and practical advice on how to become a runner for life and continually draw joy from the sport. He also offers practical guidance for beginners, intermediate, and advanced runners, such as 5-K, half-marathon, and marathon training schedules including his innovative technique known as the Yasso 800s. 
 Recounting his adventures in exotic locales like Antarctica, Africa, and Chitwan National Park in Nepal (where he was chased by an angry rhino), Yasso recommends the best exotic marathons for runners who want to grab their passports to test themselves on foreign terrain. With the wit and wisdom of a seasoned insider, he tells runners what they need to know to navigate the logistics of running in an unfamiliar country. 
 Yassoâ€™s message is this: Never limit where running can take you because each race has the potential for adventure.
",https://www.goodreads.com/book/show/2413209.My_Life_on_the_Run
28,Relentless Forward Progress: A Guide to Running Ultramarathons,Bryon Powell,3.94,208,"Marathons have become too easy for some runners. What was once the pinnacle of achievement in a runner’s life is now a stepping stone for extraordinary adventure in ultramarathoning. The number of ultrarunners—those running distances of 50k (31miles), 50 miles, 100k (62 miles), or 100 miles—is growing astronomically each year.Dean Karnazes’ Ultramarathon Man and Chris McDougall’s Born to Run have inspired tens of thousands to try these seemingly superhuman distances. But to date, there has been no practical guide to ultramarathoning. Now, Bryon Powell has written Relentless Forward Progress, the first how-to manual for aspiring ultrarunners. Powell covers every aspect of training for and racing ultra distances. This encyclopedic volume prepares runners for going farther than they have ever gone before and, in the process, shows them that they are capable of the “impossible.”",https://www.goodreads.com/book/show/10293025-relentless-forward-progress
29,80/20 Running: Run Stronger and Race Faster by Training Slower,Matt Fitzgerald,3.93,272,"This revolutionary training method has been embraced by elite runners - with extraordinary results - and now you can do it too.Respected running and fitness expert Matt Fitzgerald explains how the 80/20 running program - in which you do 80 per cent of runs at a lower intensity and just 20 per cent at a higher intensity - is the best change runners of all abilities can make to improve their performance. With a thorough examination of the science and research behind this training method, 80/20 Running is a hands-on guide for runners of all levels with training programs for 5k, 10k, half-marathon and marathon distances.In 80/20 Running you'll discover how to transform your workouts to avoid burnout.Runs will become more pleasant and less drainingYou'll carry less fatigue from one run to the nextYour performance will improve in the few high-intensity runsYour fitness levels will reach new heights",https://www.goodreads.com/book/show/20821042-80-20-running
30,"Run the World: My 3,500-Mile Journey Through Running Cultures Around the Globe",Becky  Wade,3.92,288,"From elite marathoner and Olympic hopeful Becky Wade comes the story of her year-long exploration of diverse global running communities from England to Ethiopia—nine countries, 72 host families, and over 3,500 miles of running—investigating unique cultural approaches to the sport and revealing the secrets to the success of runners all over the world.Fresh off a successful collegiate running career—with multiple NCAA All-American honors and two Olympic Trials qualifying marks to her name—Becky Wade was no stranger to international competition. But after years spent safely sticking to the training methods she knew, Becky was curious about how her counterparts in other countries approached the sport to which she’d dedicated over half of her life. So in 2012, as a recipient of the Watson Fellowship, she packed four pairs of running shoes, cleared her schedule for the year, and took off on a journey to infiltrate diverse running communities around the world. What she encountered far exceeded her expectations and changed her outlook into the sport she loved.Over the next 12 months—visiting 9 countries with unique and storied running histories, logging over 3,500 miles running over trails, tracks, sidewalks, and dirt roads—Becky explored the varied approaches of runners across the globe. Whether riding shotgun around the streets of London with Olympic champion sprinter Usain Bolt, climbing for an hour at daybreak to the top of Ethiopia’s Mount Entoto just to start her daily run, or getting lost jogging through the bustling streets of Tokyo, Becky’s unexpected adventures, keen insights, and landscape descriptions take the reader into the heartbeat of distance running around the world.Upon her return to the United States, she incorporated elements of the training styles she’d sampled into her own program, and her competitive career skyrocketed. When she made her marathon debut in 2013, winning the race in a blazing 2:30, she became the third-fastest woman marathoner under the age of 25 in U.S. history, qualifying for the 2016 Olympic Trials and landing a professional sponsorship from Asics. From the feel-based approach to running that she learned from the Kenyans, to the grueling uphill workouts she adopted from the Swiss, to the injury-recovery methods she learned from the Japanese, Becky shares the secrets to success from runners and coaches around the world. The story of one athlete’s fascinating journey, Run the World is also a call to change the way we approach the world’s most natural and inclusive sport.",https://www.goodreads.com/book/show/27213217-run-the-world
31,Run! 26.2 Stories of Blisters and Bliss,Dean Karnazes,3.91,272,"

In his follow-up to the best-selling Ultramarathon Manâ€”which Sports Illustrated called â€œfascinatingâ€ and the New York Times said was â€œfull of euphoric highsâ€â€”world-renowned ultramarathoner Dean Karnazes chronicles his unbelievable exploits and explorations in gripping detail. Karnazes runs for days on end without rest, across some of the most exotic and inhospitable places on earth, including the Australian outback, Antarctica, and the Tenderloin District of San Francisco.
From the downright hilarious to the truly profound, the linked stories in Run! create an unforgettable tableau, providing readers with the ultimate escape and offering a rare glimpse into the mind-set and motivation of an extreme athlete. Karnazes addresses the pain and perseverance and also charts his emotional state as he pushes the edges of human achievement. The tales of the friendships heâ€™s cultivated on his many adventures around the world warm the heart and are sure to captivate and inspire readers whether they run great distances, modest distances, or not at all.

",https://www.goodreads.com/book/show/9441933-run-26-2-stories-of-blisters-and-bliss
32,"Running with the Kenyans: Passion, Adventure, and the Secrets of the Fastest People on Earth",Adharanand Finn,3.9,288,"“A dusty road stretches into the distance like a pencil line across the arid landscape. Lions, rhino, and buffalo roam the plains on either side. But I haven’t come to Kenya to spot wildlife. I’ve come to run.”   Whether running is your recreation, your religion, or just a spectator sport, Adharanand Finn’s incredible journey to the elite training camps of Kenya will captivate and inspire you. Part travelogue, part memoir, this mesmerizing quest to uncover the secrets of the world’s greatest runners—and put them to the test—combines practical advice, a fresh look at barefoot running, and hard-won spiritual insights.   As a boy growing up in the English countryside, Adharanand Finn was a natural runner. While other kids struggled, he breezed through schoolyard races, imagining he was one of his heroes: the Kenyan long-distance runners exploding into prominence as Olympic and world champions. But as he grew up, pursued a career in journalism, married and had children, those childhood dreams slipped away—until suddenly, in his mid-thirties, Finn realized he might have only one chance left to see how far his talents could take him.   Uprooting his family of five, including three small children, Finn traveled to Iten, a small, chaotic town in the Rift Valley province of Kenya—a mecca for long-distance runners thanks to its high altitude, endless running paths, and some of the top training schools in the world. Finn would run side by side with Olympic champions, young hopefuls, and barefoot schoolchildren . . . not to mention the exotic—and sometimes dangerous—wildlife for which Kenya is famous.   Here, too, he would meet a cast of colorful characters, including his unflappable guide, Godfrey Kiprotich, a former half marathon champion; Christopher Cheboiboch, one of the fastest men ever to run the New York City Marathon; and Japhet, a poor, bucktoothed boy with unsuspected reservoirs of courage and raw speed. Amid the daily challenges of training and of raising a family abroad, Finn would learn invaluable lessons about running—and about life.  Running with the Kenyans is more than one man’s pursuit of a lifelong dream. It’s a fascinating portrait of a magical country—and an extraordinary people seemingly born to run.",https://www.goodreads.com/book/show/13147812-running-with-the-kenyans
33,Run Faster from the 5K to the Marathon: How to Be Your Own Best Coach,Brad Hudson,3.9,278,"Do you want to run faster? Are you trying to peak for a particular race? Would you like to find your true running potential? Brad Hudson, former Olympic Trials marathoner and current coach to Olympians like Dathan Ritzenhein, will show you the way in this practical, reader-friendly guide. Hudson is the most innovative running coach to come along in a generation. Until now, only a handful of elite athletes have been able to benefit from his methods. Now Run Faster from the 5K to the Marathon shows all runners how to coach themselves as confidently and effectively as Brad coaches his world-class athletes. Becoming your own best coach is the ticket to running faster at any distance. First you will learn to assess your abilities. Then you’ll learn how to devise a training program specifically geared to you. Filled with easy-to-follow sample training programs for distances ranging from the 5K to the marathon and abilities ranging from novice to advanced, Run Faster is the cutting-edge guide for optimal performance.With Hudson’s guidance, you can train smarter and more effectively—and avoid injury. And you’ll soon be running faster than you ever thought possible!",https://www.goodreads.com/book/show/2425949.Run_Faster_from_the_5K_to_the_Marathon
