,Book Title,Author,Rating,Pages,Description,Links
34,Running Like a Girl,Alexandra Heminsley,3.89,240,"In her twenties, Alexandra Heminsley spent more time at the bar than she did in pursuit of athletic excellence. When she decided to take up running in her thirties, she had grand hopes for a blissful runner’s high and immediate physical transformation. After eating three slices of toast with honey and spending ninety minutes on iTunes creating the perfect playlist, she hit the streets—and failed miserably. The stories of her first runs turn the common notion that we are all “born to run” on its head—and expose the truth about starting to run: it can be brutal.Running Like a Girl tells the story of how Alexandra gets beyond the brutal part, makes running a part of her life, and reaps the rewards: not just the obvious things, like weight loss, health, and glowing skin, but self-confidence and immeasurable daily pleasure, along with a new closeness to her father—a marathon runner—and her brother, with whom she ultimately runs her first marathon.But before that, she has to figure out the logistics of running: the intimidating questions from a young and arrogant sales assistant when she goes to buy her first running shoes, where to get decent bras for the larger bust, how not to freeze or get sunstroke, and what (and when) to eat before a run. She’s figured out what’s important (pockets) and what isn’t (appearance), and more.For any woman who has ever run, wanted to run, tried to run, or failed to run (even if just around the block), Heminsley’s funny, warm, and motivational personal journey from nonathlete extraordinaire to someone who has completed five marathons is inspiring, entertaining, prac­tical, and fun.",https://www.goodreads.com/book/show/17307704-running-like-a-girl
35,The Runner's Guide to the Meaning of Life,Amby Burfoot,3.89,144,"""As runners, we all go through many transitions-- transitions that closely mimic the larger changes we experience in a lifetime. First, we try to run faster. Then we try to run harder. Then we learn to accept ourselves and our limitations, and at last, we can appreciate the true joy and meaning of running.""As its opening pages reveal, The Runner's Guide to the Meaning of Life is not merely about running. It is about living-- to your fullest potential. Amby Burfoot, one of running's wisest voices, here presents 15 essential life lessons about passion, courage, materialism, failure, regeneration, and more, all learned from experience during more than 35 years of running. In this book, Amby discusses the essential traits of a runner-- traits that also are essential for all people wishing to reach their long-term goals. He discusses the writings, music, and quotes that have inspired him throughout his long career. Most important, he explains that winners are not those who cross the finish line first, but rather those who are able to discover more about themselves with every step.The Runner's Guide to the Meaning of Life is one in a series of Daybreak books that provide life lessons and spiritual perspectives from the vantage point of different occupations and passions.",https://www.goodreads.com/book/show/98249.The_Runner_s_Guide_to_the_Meaning_of_Life
36,"Run Like a Mother: How to Get Moving--and Not Lose Your Family, Job, or Sanity",Dimity McDowell,3.88,224,"In Run Like a Mother, authors and creators of Another Mother Runner, Dimity McDowell and Sarah Bowen Shea offer both inspirational advice and practical strategies to help multitasking women make running part of their busy lives. McDowell and Shea understand the various external and internal forces in everyday life that can unintentionally keep a wife—mother—working woman from lacing up her shoes and going for a run. Because the authors are multihyphenates themselves, Run Like a Mother is driven by their own running expertise and real-world experience in ensuring that running is part of their lives.More than a book, Run Like a Mother is essentially a down-to-earth, encouraging conversation with the reader on all things running, with the overall goal of strengthening a woman's inner athlete. Of course, real achievement is a healthy mix of inspiration and perspiration, which is why the authors have grounded Run Like a Mother in a host of practical tips on shoes, training, racing, nutrition, and injuries, all designed to help women balance running with their professional and personal lives.",https://www.goodreads.com/book/show/7079755-run-like-a-mother
37,The Incomplete Book of Running,Peter Sagal,3.87,197,"Peter Sagal, the host of NPR’s beloved show Wait Wait..Don’t Tell Me and a popular columnist for Runner’s World, shares his insightful and entertaining look at life and running that explores the transformative power of the sport.",https://www.goodreads.com/book/show/38530946-the-incomplete-book-of-running
38,What I Talk About When I Talk About Running,Haruki Murakami,3.85,188,"In 1982, having sold his jazz bar to devote himself to writing, Murakami began running to keep fit. A year later, he'd completed a solo course from Athens to Marathon, and now, after dozens of such races, not to mention triathlons and a dozen critically acclaimed books, he reflects upon the influence the sport has had on his life and--even more important--on his writing. Equal parts training log, travelogue, and reminiscence, this revealing memoir covers his four-month preparation for the 2005 New York City Marathon and takes us to places ranging from Tokyo's Jingu Gaien gardens, where he once shared the course with an Olympian, to the Charles River in Boston among young women who outpace him. Through this marvelous lens of sport emerges a panorama of memories and insights: the eureka moment when he decided to become a writer, his greatest triumphs and disappointments, his passion for vintage LPs, and the experience, after fifty, of seeing his race times improve and then fall back. By turns funny and sobering, playful and philosophical, What I Talk About When I Talk About Running is rich and revelatory, both for fans of this masterful yet guardedly private writer and for the exploding population of athletes who find similar satisfaction in distance running.""",https://www.goodreads.com/book/show/2195464.What_I_Talk_About_When_I_Talk_About_Running
39,"Brain Training For Runners: A Revolutionary New Training System to Improve Endurance, Speed, Health, and Results",Matt Fitzgerald,3.84,562,"Based on new research in exercise physiology, author and running expert Matt Fitzgerald introduces a first-of-its-kind training strategy that he's named ""Brain Training."" Runners of all ages, backgrounds, and skill levels can learn to maximize their performance by supplying the brain with the right feedback. Based on Fitzgerald's eight-point brain training system, this book will help runners:- Resist running fatigue - Use cross-training as brain training - Master the art of pacing - Learn to run ""in the zone"" - Outsmart injuries - Fuel the brain for maximum performancePacked with cutting-edge research, real-world examples, and the wisdom of the world's top distance runners, Brain Training for Runners offers easily applied advice and delivers practical results for a better overall running experience.",https://www.goodreads.com/book/show/1047364.Brain_Training_For_Runners
40,Running with the Mind of Meditation: Lessons for Training Body and Mind,Sakyong Mipham,3.84,208,"A unique fitness program from a highly respected spiritual leader that blends physical and spiritual practice for everyone - regardless of age, spiritual background, or ability - to great benefits for both body and soul.   As a Tibetan lama and leader of Shambhala (an international community of 165 meditation centers), Sakyong Mipham has found physical activity to be essential for spiritual well-being. He's been trained in horsemanship and martial arts but has a special love for running. Here he incorporates his spiritual practice with running, presenting basic meditation instruction and fundamental principles he has developed. Even though both activities can be complicated, the lessons here are simple and designed to show how the melding of internal practice with physical movement can be used by anyone - regardless of age, spiritual background, or ability - to benefit body and soul.",https://www.goodreads.com/book/show/13151427-running-with-the-mind-of-meditation
41,Natural Born Heroes: How a Daring Band of Misfits Mastered the Lost Secrets of Strength and Endurance,Christopher McDougall,3.82,337,"The best-selling author of Born to Run now travels to the Mediterranean, where he discovers that the secrets of ancient Greek heroes are still alive and well on the island of Crete, and ready to be unleashed in the muscles and minds of casual athletes and aspiring heroes everywhere.  After running an ultramarathon through the Copper Canyons of Mexico, Christopher McDougall finds his next great adventure on the razor-sharp mountains of Crete, where a band of Resistance fighters in World War II plotted the daring abduction of a German general from the heart of the Nazi occupation. How did a penniless artist, a young shepherd, and a playboy poet believe they could carry out such a remarkable feat of strength and endurance, smuggling the general past thousands of Nazi pursuers, with little more than their own wits and courage to guide them?  McDougall makes his way to the island to find the answer and retrace their steps, experiencing firsthand the extreme physical challenges the Resistance fighters and their local allies faced. On Crete, the birthplace of the classical Greek heroism that spawned the likes of Herakles and Odysseus, McDougall discovers the tools of the hero—natural movement, extraordinary endurance, and efficient nutrition. All of these skills, McDougall learns, are still practiced in far-flung pockets throughout the world today. More than a mystery of remarkable people and cunning schemes, Natural Born Heroes is a fascinating investigation into the lost art of the hero, taking us from the streets of London at midnight to the beaches of Brazil at dawn, from the mountains of Colorado to McDougall’s own backyard in Pennsylvania, all places where modern-day athletes are honing ancient skills so they’re ready for anything.  Just as Born to Run inspired readers to get off the treadmill, out of their shoes, and into the natural world, Natural Born Heroes will inspire them to leave the gym and take their fitness routine to nature—to climb, swim, skip, throw, and jump their way to their own heroic feats.",https://www.goodreads.com/book/show/22889750-natural-born-heroes
42,Why We Run: A Natural History,Bernd Heinrich,3.8,306,"In Why We Run, biologist, award-winning nature writer, and ultramarathoner Bernd Heinrich explores a new perspective on human evolution by examining the phenomenon of ultraendurance and makes surprising discoveries about the physical, spiritual -- and primal -- drive to win. At once lyrical and scientific, Why We Run shows Heinrich's signature blend of biology, anthropology, psychology, and philosophy, infused with his passion to discover how and why we can achieve superhuman abilities.",https://www.goodreads.com/book/show/19567944-why-we-run
43,Running & Being: The Total Experience,George Sheehan,3.77,256,"The book that helped get the world running is back. This New York Times bestseller written by the late runner, doctor, philosopher, Dr. George Sheehan is a timeless classic. It tells of Dr. Sheehan's midlife return to the world of exercise, play, and competition. Focusing on the importance of ""play"", Sheehan describes his program for fitness and joy, sharing with the reader how the body helps open up our mental and spiritual energies.",https://www.goodreads.com/book/show/159827.Running_Being
44,"To Be a Runner: How Racing Up Mountains, Running with the Bulls, or Just Taking On a 5-K Makes You a Better Person (and the World a Better Place)",Martin Dugard,3.76,238,"Now with a new introduction and additional stories accumulated in the eight years since its original publication, To Be a Runner is a fresh and exciting update on a running classic. With an exuberant mix of passion, insight, instruction, and humor, bestselling author and lifelong runner Martin Dugard takes a journey through the world of running to illustrate how the sport helps us fulfill that universal desire to be the best possible version of ourselves each and every time we lace up our shoes. To Be a Runner represents a new way to write about running by bridging the chasm between the two categories of running books: how-to and personal narrative. Spinning colorful stories of his running and racing adventures on six continents, Dugard considers what it means to truly integrate running into one's life. As entertaining as it is provocative, To Be a Runner is about far more than running: It is about life, and how we should live it..",https://www.goodreads.com/book/show/10814907-to-be-a-runner
45,The Way of the Runner: A Journey into the Fabled World of Japanese Running,Adharanand Finn,3.76,326,"It may come as a surprise to many people, but Japan is the most running-obsessed country on earth. A 135-mile relay race, or ""ekiden"" is the country's biggest annual sporting event. Thousands of professional runners compete for corporate teams in some of the most competitive races in the world. The legendary ""marathon monks"" run a thousand marathons in a thousand days to reach spiritual enlightenment.Yet so much of Japan's running culture remains a mystery to the outside world, on par with many of the unique aspects of contemporary Japan. Adharanand Finn, the award-winning author of Running with the Kenyans, spent six months immersed in this one of a kind running culture to discover what it might teach us about the sport and about Japan.As an amateur runner about to turn 40, he also hoped to find out whether a Japanese approach to training might help him run faster. What he learns—about competition, team work, form, chasing personal bests, and about himself—will fascinate and surprise anyone keen to explore why we run and how we might do it better.",https://www.goodreads.com/book/show/26889751-the-way-of-the-runner
46,"Running on Empty: An Ultramarathoner's Story of Love, Loss, and a Record-Setting Run Across America",Marshall Ulrich,3.75,320,"A fascinating glimpse into the mind of an ultramarathon runner and the inspirational saga of his run across America. The ultimate endurance athlete, Marshall Ulrich has run more than one hundred foot races averaging over one hundred miles each, completed twelve expedition-length adventure races, and ascended the seven summits-- including Mount Everest. Yet his run from California to New York--the equivalent of running two marathons and a 10k every day for nearly two months straight--proved to be his most challenging effort yet. In ""Running on Empty ""he shares the gritty backstory of his run and the excruciating punishments he endured on the road. Ulrich also reaches back nearly thirty years to when the death of his first wife drove him to run from his pain. Ulrich's memoir imbues an incredible read with a universal message for athletes and nonathletes alike: face the toughest challenges, overcome debilitating setbacks, and find deep fulfillment in something greater than achievement.",https://www.goodreads.com/book/show/10557318-running-on-empty
47,50/50: Secrets I Learned Running 50 Marathons in 50 Days -- And How You Too Can Achieve Super Endurance!,Dean Karnazes,3.73,285,"This is an account of the amazing things you can achieve when the mind and the body work together. It tells of Karnazes challenge to run 50 marathons in 50 days. The book is also packed with the author's secrets including what to do when you hit a wall, how to adapt quickly to drastic terrain, and much more.",https://www.goodreads.com/book/show/2942520-50-50
48,"ChiRunning: A Revolutionary Approach to Effortless, Injury-Free Running",Danny Dreyer,3.72,236,"Join the hundreds of thousands of people who are now running without injury or pain using the ChiRunning method. This new edition is fully updated with fresh insights and innovative training techniques from one of the sport's leading voices. Danny Dreyer teaches us how to heal and prevent injuries and also to run faster, farther, and with much less effort at any age or ability.With more than 150,000 copies in print, this groundbreaking program makes running safe and fun for beginning and seasoned runners, while also giving competitive runners the edge they seek. ChiRunning employs the deep power reserves in the core muscles, an approach found in disciplines such as yoga, Pilates, and in this case T'ai Chi.
   Make knee pain and shin splints a thing of the past 
   Experience the natural efficiency of the midfoot strike 
   Dramatically reduce your potential for injury 
   Transform your running with our new 10-step training program 
ChiRunning provides powerful insight and transforms running from a high-injury sport to a body-friendly fitness phenomenon. Join the revolution!",https://www.goodreads.com/book/show/391659.ChiRunning
49,Run or Die,Kilian Jornet,3.59,208,"“The most dominating endurance athlete of his generation.” — New York TimesAn exceptional athlete. A dominating force. An extraordinary person.Kilian Jornet has conquered some of the toughest physical tests on the planet. He has run up and down Mt. Kilimanjaro faster than any other human being, and struck down world records in every challenge that has been proposed, all before the age of 25. Redefining what is possible, Jornet continually pushes the limits of human ability, astonishing competitors with his near-superhuman fitness and ability.Jornet adores the mountains with the same ferocity with which he runs them. In Run or Die he shares his passion, inviting readers into a fascinating world rich with the beauty of rugged trails and mountain vistas, the pulse-pounding drama of racing, and an intense love for sport and the landscapes that surround him.In turns inspiring, insightful, candid, and deeply personal, this is a book written from the heart of the world’s greatest endurance runner, for whom life presents one simple choice: Run. Or die.“Trail running’s first true breakout star…[Jornet] has yet to find a record he can’t shatter.” — Runner’s World",https://www.goodreads.com/book/show/19120728-run-or-die
